id;name;bio
p1;Christopher Nolan;British-American filmmaker known for cerebral, non-linear storytelling.
p2;Leonardo DiCaprio;American actor known for intense character roles.
p3;Christian Bale;English actor famous for physical transformations.
p4;Keanu Reeves;Canadian actor known for action and sci-fi films.
p5;Lana Wachowski;American filmmaker, co-creator of The Matrix.
p6;Lilly Wachowski;American filmmaker, co-creator of The Matrix franchise.
p7;Chad Stahelski;American film director, stuntman, and martial artist.
